Sentence,Entity,Sentiment
"the service is friendly, if not the most prompt in the world, the food is great, and the prices, while not cheap, won't put your wallet out of commission.",food,positive
"the service is friendly, if not the most prompt in the world, the food is great, and the prices, while not cheap, won't put your wallet out of commission.",service,positive
"and it all comes at a very reasonable price (congee, noodles, and rice dishes are no more than $3-6 each).",price,positive
the waitresses are nice--also you can just get counter service sit.,service,positive
"you can certainly find restaurants that offer a superior fine dining experience, but for superb food at reasonable prices, la villa can't be beat.",price,positive
"you can certainly find restaurants that offer a superior fine dining experience, but for superb food at reasonable prices, la villa can't be beat.",food,positive
won't or can't is not in the service directory.,service,positive
"the red curry is weak and tasteless, the pad thai is stuck together and lumpy, the rice is often overcooked, and the seafood is pretty sketchy.",food,negative
the wine list is extensive and can easily hike up an otherwise reasonably priced meal.,price,positive
"i would recommend roxy's for that, but not for their food.",food,negative
"overall i was impressed and will return, it's a great qpr (quality to price ratio).",price,positive
"the puke green walls leave a lot to be desired, but the food is very good.",food,positive
big and soft as well as good lunch food.,food,positive
"no food snobs allowed, this place is for people who appreciate good food.",food,positive
i liked the food at this quasi-thai restaurant.,food,positive
by far the best salad i have had in a fast food restaurant.,food,positive
the wine the service was very good too.,service,positive
"i have been there many times, and food is good and consistent.",food,positive
"while sapphire is certainly not lacking in ambiance, and probably has the best decor of any indian restaurant i have been to in new york city, the food was not what i had hoped for.",food,negative
"the menu consisted of standard brassiere food, better then places like balthazar etc.",food,positive
"i have been a longtime fan of holy basil in the east village, and while i do believe their food has slightly slipped in quality, i have been hesitant to be disloyal.",food,negative
"you don't go to mizu for excellent service, you go for the large amounts of food, the amiable atmosphere, and the hole-in-the-wall feeling of the place.",food,positive
"you don't go to mizu for excellent service, you go for the large amounts of food, the amiable atmosphere, and the hole-in-the-wall feeling of the place.",service,negative
"the service is always bad though, don't expect much of anything from your server, and i would not recommend bringing a date here either.",service,negative
the service is descent even when this small place is packed.,service,positive
"the food here is rather good, but only if you like to wait for it.",food,positive
the food is inventive but still keeps traditional indian flavoring.,food,positive
service was very friendly.,service,positive
so all i'm trying to say is this restaurant is by far the best thai food restaurant i've ever been to.,food,positive
food was ok - fish was cooked well.,food,positive
we actually left hungry and went across the street to wo hop at 15 mott street for some good chinese food.,food,positive
the staff offers impeccable service.,service,positive
"this place doesn't compare with mamoun's in terms of price, freshness, value, and consisent quality, but that's just my opinion.",price,negative
"i have known about this secret for the last 13 years, emilio(the godfather) has continued to serve food and wine for the gods at mortal prices.",price,positive
"i have known about this secret for the last 13 years, emilio(the godfather) has continued to serve food and wine for the gods at mortal prices.",food,positive
"the service was attentive, yet unimposing, the food was far better than many notorious restaurants in midtown and the wine list is extensive and well priced.",price,positive
"the service was attentive, yet unimposing, the food was far better than many notorious restaurants in midtown and the wine list is extensive and well priced.",food,positive
"the service was attentive, yet unimposing, the food was far better than many notorious restaurants in midtown and the wine list is extensive and well priced.",service,positive
"the food is yummy, especially their cooked-to-perfection mussels in spicy tomato sauce and their shoestring crispy fries.",food,positive
the food is authentic italian - delicious!,food,positive
the service is good and ambience is good for a date or group outing.,ambience,positive
the service is good and ambience is good for a date or group outing.,service,positive
it's all about the food !!,food,positive
fast service.,service,positive
"the service was bad, the food took to forever to come, we sat on the upper level.",service,negative
"we a menu that rearely changes,e xcept for one or two specials, the quality and care they put in thier food in evident.",food,positive
this restaurant is a wonderful place to go many times and it is reasonably priced.,price,positive
"bottom line: b+ for the food, f for the service.",food,positive
"bottom line: b+ for the food, f for the service.",service,negative
"stick to dimsum, not super overpriced noodles.",price,negative
the service is fine and they allow you to enjoy the view.,service,positive
delicious simple food in nice outdoor atmosphere.,food,positive
the only fallback on this restaurant is the prices.,price,negative
the food is delicious.,food,positive
this place has the the correct ambience and an excellent staff to make you feel like a guest and a friend at the same time.,ambience,positive
"the food is outstanding and the service is quick, friendly and very professional.",food,positive
"the food is outstanding and the service is quick, friendly and very professional.",service,positive
service is fast and friendly.,service,positive
the food was boring and expensive.,food,negative
"the ambience is pretty and nice for conversation, so a casual lunch here would probably be best.",ambience,positive
the service is ok but could be better.,service,negative
"we love the food, drinks, and atmosphere!",food,positive
i was here a few weeks back and we had the worst customer service experience at a restaurant ever.,service,negative
"the vibe is very relaxed and cozy, service was great and the food was excellent!",food,positive
"the vibe is very relaxed and cozy, service was great and the food was excellent!",service,positive
the service was friendly and the atmosphere was casual.,service,positive
"this is the best secret place in midtown', i heard that from the bartender, after having brilliant food ( try steak with portobello mushrooms) and drinks on the bar last tuesday.",food,positive
the service was excellent - friendly and attentive.,service,positive
"in any event, even though its a bit on the pricey side, we still love this restaurant and will definitely go back.",price,negative
"i don't like indian food too much and this was delicious, however you want to factor that into the equation.",food,positive
and i would have to agree with the masses in terms of service - delivery is their achilles' heel.,service,negative
"nice ambiance, nice little bar, good bartender, francois, and good service.",service,positive
simple comfort food and what hot and lage portions.,food,positive
the bagels are also reasonably priced for nyc.,price,positive
"our waiter was fine, the place looks nice in that not-trying-too-hard way, but at those prices, a little more should be expected of your food.",price,negative
"our waiter was fine, the place looks nice in that not-trying-too-hard way, but at those prices, a little more should be expected of your food.",food,negative
"the food is spectacular, from the appitizers to the main course, and then of course the desserts, (wow) you'll need no more.",food,positive
"average to good thai food, but terrible delivery.",food,positive
"the food is amazing, rich pastas and fresh doughy pizza.",food,positive
"food was very good, but not what i would consider out of this world.",food,positive
"try the pad thai, it's fabulous and their prices are so cheap!",price,positive
food is great and inexpensive.,food,positive
the price very reasonable.,price,positive
"it can be a little confusing as to where one goes to order, but once the food is ordered, you are in for a treat.",food,positive
it was so bad i actually refused to pay for my food.,food,negative
i recommend this spot to anyone who enjoys  fine cuisine at reasonable prices.,price,positive
"the staff was very attentive, the ambience lovely, and the food superb.",food,positive
"the staff was very attentive, the ambience lovely, and the food superb.",ambience,positive
"i love when restaurants think using fancy expensive ingrediants makes the food fine cuisine, even with no idea how to use them.",food,negative
the pizza and wine were excellent-the service too--but what really made this place was the backyard dining area.,service,positive
"the waiters are sweet, the food is tasty and the bill is never too large.",food,positive
"the service was superb, they treat you like family.",service,positive
"we all had the tasting menu and unlike some of the other reviews, i felt there was more than enough food.",food,positive
"- for dessert we split chocolate cake and vanilla gelato (with espresso), which were tasty, but i thought a bit overpriced.",price,negative
the counter service is bad.,service,negative
"service here was great, food was fantastic.",food,positive
"service here was great, food was fantastic.",service,positive
"the food, served in small tasting portions (as an option) is very good with each dish being better than the next.",food,positive
"oh, but wait, we were out of drinks (which were also delightfully overpriced).",price,negative
the service is fantastic.,service,positive
"over time, the food quality has decreased substantially, it is a lot less crowded than it used to, and the service must definitely be part of the reason.",food,negative
"over time, the food quality has decreased substantially, it is a lot less crowded than it used to, and the service must definitely be part of the reason.",service,negative
great pizza and fantastic service.,service,positive
"while this is a pretty place in that overly cute french way, the food was insultingly horrible.",food,negative
"great wine list (italian), good food, service was initially fine.",food,positive
"unlike other places in nyc where the sandwiches you want only come as a triple-decker, here you can get what you want in a reasonably-sized portion (and price).",price,positive
of course the reason its so packed is because the food is so delicious!,food,positive
"the tables are crammed way too close, the menu is typical of any italian restaurant, and the wine list is simply overpriced.",price,negative
the food was actually aweful.,food,negative
we went around 9:30 on a friday and it had died down a bit by then so the service was great!,service,positive
the sushi is average and the prices are anything but.,price,negative
"the food is consistently wonderful - i've been coming here for years, and the owner has always been accomodating and friendly.",food,positive
and the food was fantastic.,food,positive
"if it isn't for the food (a+++), it must be the service or the ambience.",food,positive
"if it isn't for the food (a+++), it must be the service or the ambience.",ambience,positive
"if it isn't for the food (a+++), it must be the service or the ambience.",service,positive
"i like the ambience, it's very dark and original.",ambience,positive
this place is not worth the prices.,price,negative
"the last two times i ordered from here my food was soo spicy that  i could barely eat it, and the spice took away from the flavor of the dish.",food,negative
"$6 and there is much tasty food, all of it fresh and continually refilled.",food,positive
"just straight up cheap, good food.",food,positive
"the staff makes you feel at home, the food is great and the atmosphere is wonderful!",food,positive
edible but really a ripoff at those prices given whats in the area.,price,negative
the service was the only thing good about this restaurant.,service,positive
service- friendly and attentive.,service,positive
service was very prompt but slightly rushed.,service,positive
"great food, great decor, great service.",food,positive
"great food, great decor, great service.",service,positive
i've dined at alain ducasse's restaurant in monte carlo for half the price for the same excellent dining experience.,price,positive
"yeah, sometimes the service can be slow.",service,negative
the service was attentive without being overbearing and each dish we tried was wonderful from the spring rolls to the cod with pineapple tempura.,service,positive
"the only weird thing was if we got a bottle, the waitress would have simply multiplied the glass price x4, which makes no sense whatsoever.",price,negative
"the place is small and intimate and you may feel a little crowded, but the service is excellent and it's great for friends out, a romantic date, or a special occassion.",service,positive
the service was excellent and the food was delicious.,food,positive
the service was excellent and the food was delicious.,service,positive
service was also very good.,service,positive
i'm happy to have nosh in the neighborhood and the food is very comforting.,food,positive
love the food.,food,positive
"the sushi has been from average to below average, the wait service has always been sub-par the atmosphere goes from nice to really irritating (if you sit in the area beyond the kitchen, the acousitcs are horrid, everything echoes is extremely loud).",service,negative
"alone for 100 bucks, it is really overprice.",price,negative
but the service was a bit slow.,service,negative
spreads and toppings are great - though a bit pricey.,price,negative
and their prices are very high - they actually think that they can get away with charging such prices for such terrible food and service!,price,negative
and their prices are very high - they actually think that they can get away with charging such prices for such terrible food and service!,food,negative
and their prices are very high - they actually think that they can get away with charging such prices for such terrible food and service!,service,negative
"the service was excellent, the food was excellent, but the entire experience was very cool.",food,positive
"the service was excellent, the food was excellent, but the entire experience was very cool.",service,positive
the service is good and the resturant is clean.,service,positive
"the cafe itself was really nice with comfortable outdoor chairs and tables, but the service could have been better.",service,negative
food is excellent.,food,positive
"both are very reasonably priced (around $8 for dinner and $5 for lunch), and are delicious and filling.",price,positive
"ambience is so cute and quaint, good for business although we were there on vacation.",ambience,positive
"good food at the restaurant (a bit expensive, but great if you want to impress your date).",food,positive
i highly recommend caviar russe to anyone who wants delicious top grade caviar and fantastic service.,service,positive
i have eaten there 3-4 times and the food was always good.,food,positive
the service was great as well.,service,positive
"the food was delicious, the atmosphere was relaxed, and we have now adopted plate 347 as our secret on second!",food,positive
"i found the food, service and value exceptional everytime i have been there.",food,positive
"i found the food, service and value exceptional everytime i have been there.",service,positive
we ate at this thai place following the reviews but very unhappy with the foods.,food,negative
"the drinks are a saving grace, but service staff, please, get over yourselves.",service,negative
the prices are exceptionally reasonable for food of this caliber.,price,positive
the prices are exceptionally reasonable for food of this caliber.,food,positive
i had been a regular due to the consistently good food and ease of getting a table.,food,positive
"the food is good, i can't lie.",food,positive
"great food, lt's of it, more then one person can eat!",food,positive
"the ambience was so fun, and the prices were great, on top of the fact that the food was really tasty.",price,positive
"the ambience was so fun, and the prices were great, on top of the fact that the food was really tasty.",food,positive
"the ambience was so fun, and the prices were great, on top of the fact that the food was really tasty.",ambience,positive
the food was very well prepared.,food,positive
really tasty spring rolls and noodles for a good price though.,price,positive
"the food arrived 20 minutes after i called, cold and soggy.",food,negative
"the prices cannot be beat for the quality, quantity, freshness and taste.",price,positive
incredibly poor service an food quality at exorbitant prices.,price,negative
incredibly poor service an food quality at exorbitant prices.,food,negative
incredibly poor service an food quality at exorbitant prices.,service,negative
we usually just get some of the dinner specials and they are very reasonably priced and very tasty.,price,positive
horrible food and horrible service.,food,negative
horrible food and horrible service.,service,negative
they treated us well and the food was extremely fresh and well-prepared.,food,positive
"even if the food wasn't this good, the garden is a great place to sit outside and relax.",food,positive
"volare virgins or weekly regulars, everyone gets treated the same and you can't ask for more than that when the service is this friendly.",service,positive
"the food came out wrong, the waiter was no where to be found and the wine showed up at the end of the meal.",food,negative
no you're going to go back because the food was good.,food,positive
the food was great and the service was even better.,food,positive
the food was great and the service was even better.,service,positive
i'd highly recommend it for a special occasion -- it provides and intimate setting and nice service.,service,positive
"they did give a 15% discount at the end, wasn't enough, as they knew the service was horrible.",service,negative
"just because it's cheap does not mean the portions are small or the food is nasty, it is great!",food,positive
"however, it's the service that leaves a bad taste in my mouth.",service,negative
the price was extremely reasonable for the appetizers and food we ate.,price,positive
all in all the food was above average and i would return to see how they operate with four or less dinners.,food,positive
"delicious food, excellent service, and a pretty atmosphere make this a great choice for dinner and the $5.99 lunch buffet makes it an even better choice for lunch!",food,positive
"delicious food, excellent service, and a pretty atmosphere make this a great choice for dinner and the $5.99 lunch buffet makes it an even better choice for lunch!",service,positive
"great wine, great food.",food,positive
the food and staff always surprise me with the new heights they are taken to.,food,positive
"however, if you want great food at a great price and don't mind the decor, you can't beat this place.",price,positive
"however, if you want great food at a great price and don't mind the decor, you can't beat this place.",food,positive
the service is outstanding and my crab-cake eggs benedict could not have been better.,service,positive
"its location is good and the fact that hutner college is near and their prices are very reasonable, makes students go back to suan again and again.",price,positive
deliveries often take up to an hour and the prices are higher than most other pizzerias in the area.,price,negative
"from the appetizers we ate, the dim sum and other variety of foods, it was impossible to criticize the food.",food,positive
