Sentence,Entity,Sentiment
"with so many good restaurants on the uws, i don't need overpriced food, absurdly arrogant wait-staff who don't recognize they work at a glorified diner, clumsy service, and management that doesn't care.",service,negative
the service is a little scatty at times but all is forgiven when the food arrives.,food,positive
the service is a little scatty at times but all is forgiven when the food arrives.,service,negative
"the atmosphere isn't the greatest , but i suppose that's how they keep the prices down .",price,positive
"if your favorite chinese food is general tao chicken, then this is not your place.",food,negative
"not only is the cuisine the best around, the service has always been attentive and charming.",service,positive
"the production is a symphony, alot of fun to experience.the food sublime for the most part.",food,positive
"waiters tend to forget drinks completely, food portions are so tiny, two people have trouble sharing one entree.",food,negative
"interesting selection, good wines, service fine, fun decor.",service,positive
priced at upper intermediate range.,price,negative
"if you live in new york city, you'll find better food at small restaurants outside of time square and spend half the amount.",food,negative
"they didn't disappoint, service from the second i arrived at the door was extremely pleasant and attentive with almost one server per table.",service,positive
the food is great and they have a good selecion of wines at reasonable prices.,price,positive
the food is great and they have a good selecion of wines at reasonable prices.,food,positive
"for the location, the prices are very reasonable.",price,positive
my friend's food was also the complete opposite of what it's supposed to taste like (and look like).,food,negative
"we have been to this place many times, and always have great food, wine, and service.",food,positive
"we have been to this place many times, and always have great food, wine, and service.",service,positive
"haru serves very fresh fish, has a trendy, modern ambiance, prime location on park avenue south and friendly service.",service,positive
"very romantic fires - i've literally spent hours at lanterna, drinking wine from their extensive wine and enjoying the ambience.",ambience,positive
"great food, great prices, great service.",price,positive
"great food, great prices, great service.",food,positive
"great food, great prices, great service.",service,positive
"this place, however, has a lot less pretension than joya and the thai food is still above-average.",food,positive
food is great.,food,positive
"but when you are seated the waitresses are great, they explain everything on the menu, and the price of the food is really cheap for the service you get.",price,positive
"but when you are seated the waitresses are great, they explain everything on the menu, and the price of the food is really cheap for the service you get.",service,positive
go to volare for 1st class service and terrific food.,food,positive
go to volare for 1st class service and terrific food.,service,positive
"it's super-trendy and there's always someone to take that empty seat, so it seems that customer service has been deemed not of the essence.",service,positive
"the sandwiches are dry, tasteless and way overpriced.",price,negative
price no more than a jersey deli but way better.,price,positive
"a very inviting restaurant, with friendly service.",service,positive
the drinks are always welll made and wine selection is fairly priced.,price,positive
not a small feat for good french food in the area.,food,positive
food was average but tasty.,food,positive
delicious food at a great price but do not go here on a cold day and sit by the front door.,price,positive
delicious food at a great price but do not go here on a cold day and sit by the front door.,food,positive
"overall, i'm still impressed that the place even exists and the prices are quite decent but then again, its chinatown.",price,positive
"the food inludes famous scrumptious bombay style chaat such as bhelpuri, sevpuri and samosa chaats, as well as other great indian appetizers.",food,positive
i'm still mad that i had to pay for lousy food.,food,negative
definite go if you're used to good indian restaurant food from abroad.,food,positive
"decent thai food in cute - though a bit dank - little nolita hangout, but service terrible.",food,positive
"decent thai food in cute - though a bit dank - little nolita hangout, but service terrible.",service,negative
"the food is mostly made from scratch, fresh and well prepared.",food,positive
sushi wasn't anything spectacular for the price.,price,negative
"so, for good food i'd recommend it, but not for a fun night out.",food,positive
the exotic food is beautifully presented and is a delight in delicious combinations.,food,positive
service was prompt and courteous.,service,positive
"disappointing food, lousy service.",food,negative
"disappointing food, lousy service.",service,negative
"if you want a casual neighborhood bistro that has great food and excellent service, this is the place.",food,positive
"if you want a casual neighborhood bistro that has great food and excellent service, this is the place.",service,positive
"over price, and small portions .",price,negative
the food was well prepared and the service impecable.,food,positive
the food was well prepared and the service impecable.,service,positive
while the food was good (certainly no il mulino) the service was horrendous.,food,positive
while the food was good (certainly no il mulino) the service was horrendous.,service,negative
service is not what one would expect from a joint in this price category.,service,negative
the food was very expensive (we spent $160 for lunch for two) but extremely tasty.,food,positive
"the signs, the specials menus, food, and even all the waitstaff are all totally japanese.",food,positive
the food was absolutely amazing!!,food,positive
"an excellent alternative to fast food joints and ordering in but, the food was slightly disappointing.",food,negative
mermaid inn is an overall good restaurant with really good seafood.,food,positive
all of the pizzas are terrific and the price is even better!,price,positive
"it is about food and ambiance, and imagine how dreadful it will be it we only had to listen to an idle engine.",food,negative
the food was good too.,food,positive
the menu seemed to have a wide variety of dishes for seafood lovers and interesting ways of preparing them.,food,positive
"great food, great lay out and awesome service.",food,positive
"great food, great lay out and awesome service.",service,positive
i have lived in japan for 7 years and the taste of the food and the feel of the restaurant is like being back in japan.,food,positive
"they have it all -- great price, food, and service.",price,positive
"they have it all -- great price, food, and service.",food,positive
"they have it all -- great price, food, and service.",service,positive
"the food was amazing, the service was so attentive and personable, and how about that ambience!",food,positive
"the food was amazing, the service was so attentive and personable, and how about that ambience!",ambience,positive
"the food was amazing, the service was so attentive and personable, and how about that ambience!",service,positive
the food has been consistant for years and it never lets you down.,food,positive
sometimes i get good food and ok service.,food,positive
the food was spicy and delicious.,food,positive
"anyways, if you're in the neighborhood to eat good food, i wouldn't waste my time trying to find something, rather go across the street to tamari.",food,negative
this was my frist time at cafe st. bart's and i must say how delicous the food and the service was.,food,positive
this was my frist time at cafe st. bart's and i must say how delicous the food and the service was.,service,positive
"while we enjoyed the food, we were highly disappointed by the poor service (waiter was not quite competent and slow service) and lack of remorse.",food,positive
"while we enjoyed the food, we were highly disappointed by the poor service (waiter was not quite competent and slow service) and lack of remorse.",service,negative
"the service, however, was a bright flower in a garden.",service,positive
nothing fancy but really good food with pretty reasonable price.,price,positive
nothing fancy but really good food with pretty reasonable price.,food,positive
"the chicken pot pie is excpetiona, the cheeseburger huge and delictable, and the service professional wan warm.",service,positive
not worth the prices.,price,negative
service was good and food is wonderful.,food,positive
service was good and food is wonderful.,service,positive
she gets 10 for her excellent service and advice.,service,positive
"being a fan of spicy ethnic foods, indian included, i made friends with this place long ago.",food,positive
the quality of food at this restaurant accompanied  by fantastic live jazz makes this place a perfect 10!,food,positive
"i have eaten at saul, many times, the food is always consistently, outrageously good.",food,positive
sandwiches tho pricey are over stuffed - can serve 2 persons easily thus cost effective!,price,positive
"if presentation and service is your thing, then this magic show works.",service,positive
why do people rave about the ambience.,ambience,negative
"if you're looking for a great meal at a decent price, go to del frisco's!",price,positive
"although the tables may be closely situated, the candle-light, food-quality and service overcompensate.",food,positive
"although the tables may be closely situated, the candle-light, food-quality and service overcompensate.",service,positive
the food was delicious and the waiter was incredibly helpful and attentive (considering we were the only ones there for the first hour).,food,positive
"ambience is delightful, service impeccable.",ambience,positive
"ambience is delightful, service impeccable.",service,positive
"service was excellent, and the ac worked very well too (thank god, it was hot!).",service,positive
"the staff was accomodating, the food was absolutely delicious and the place is lovely.",food,positive
"my picks are:  - scallion pancake (fried with vegetable juice, very special and tasty)  - guizhou chicken  - shredded squid family style (one of my personal favorites)  - sichuan spicy soft shell crab  - shuizhu fish (this one is for hardcore sichuan food fans, i wouldn't recommend to my american friends as it's very spicy.",food,positive
"but for whatever reason, prices are about twice as high.",price,negative
i am relatively new to the area and tried pick a bgel on 2nd and was disappointed with the service and i thought the food was overated and on the pricey side.,price,negative
i am relatively new to the area and tried pick a bgel on 2nd and was disappointed with the service and i thought the food was overated and on the pricey side.,food,negative
i am relatively new to the area and tried pick a bgel on 2nd and was disappointed with the service and i thought the food was overated and on the pricey side.,service,negative
"excellent atmosphere, delicious dishes good and friendly service.",service,positive
great food and the prices are very reasonable.,price,positive
great food and the prices are very reasonable.,food,positive
"a cool bar with great food, and tons of excellent beer.",food,positive
the ambience is authentic and relaxing and we have always received attentive and prompt service.,ambience,positive
the ambience is authentic and relaxing and we have always received attentive and prompt service.,service,positive
"great food (spinach and corn dumplings and massamman curry), very friendly and no nonsense service and a clean and funky bathroom.",food,positive
"great food (spinach and corn dumplings and massamman curry), very friendly and no nonsense service and a clean and funky bathroom.",service,positive
"great service, great food.",food,positive
"great service, great food.",service,positive
"the food is expensive, but worth every bite.",food,positive
"sometimes i get bad food and bad service, sometimes i get good good and bad service.",service,negative
"it's the perfect restaurant for ny life style, it got cool design, awsome drinks and food and lot's of good looking people eating and hanging at the pink bar...",food,positive
"if you love seafood, you would love this place!",food,positive
"good, fast service.",service,positive
they charge different prices all the time.,price,negative
"i was in love with pongsri on 48th, but compared to suan it is slow in service and overpriced.",price,negative
"i was in love with pongsri on 48th, but compared to suan it is slow in service and overpriced.",service,negative
"the staff is accomodating, the ambiance is exciting and yet relaxed, and the food is out of this world!",food,positive
"the food was delicious (i had a halibut special, my husband had steak), and the service was top-notch.",food,positive
"the food was delicious (i had a halibut special, my husband had steak), and the service was top-notch.",service,positive
it's the only place you can get yummy authentic japanese comfort food.,food,positive
we took advanatage of the half price sushi deal on saturday so it was well worth it.,price,positive
the prices were cheap compared to the quality of service and food.,price,positive
the prices were cheap compared to the quality of service and food.,food,positive
the prices were cheap compared to the quality of service and food.,service,positive
the food was authentic.,food,positive
the dim sum is delectable while the prices are quite easy on the wallet.,price,positive
there is no excuse for such lousy service!,service,negative
i must say it's a little pricey for the food because it was not as spectacular as the view.,price,negative
no gimmicks here -- the food speaks for itself in its freshness and preparation.,food,positive
one should not go to lucky strike for the food.,food,negative
the service is awful--the last time i was there (and i do mean the last time) we were told that they needed our table so we would have to leave.,service,negative
we were also seated promptly at the time of our reservation and the service was very quick and professional.,service,positive
the food there are sastifying.,food,positive
the food was good.,food,positive
"when we sat, we got great and fast service.",service,positive
"the service was poor, restaurant poorly lit, staff not very attentive and i would have rather eaten at a mcdonald's than this joint.",service,negative
service was slow had to wait to order and get food although not crowded.,service,negative
"the food was below average, the service was pathetic, there was no ambience at all.",food,negative
"the food was below average, the service was pathetic, there was no ambience at all.",ambience,negative
"the food was below average, the service was pathetic, there was no ambience at all.",service,negative
service was efficient courteous.,service,positive
"while the prices are nothing special, the portions are huge.",price,positive
"the menu is prix fixe, so be prepared to spend at least $60 per person, but it is well worth itsuperb food.",food,positive
decor is nice though service can be spotty.,service,positive
"aside from the rushed service, we were very impressed with the food and the drinks.",food,positive
"aside from the rushed service, we were very impressed with the food and the drinks.",service,negative
they've the best desserts and mixed drinks as well as snack foods.,food,positive
"the blond wood decor is very soothing, the premium sake is excellent and the service is great.",service,positive
service was very good and warm.,service,positive
food was good and the view of the new york city skiline was terrific even on a foggy rainy day like that of when i went.,food,positive
the food is nothing like its menu description.,food,negative
the food is above average for midtown and sligtly better than some of the other heartland breweries in the city.,food,positive
the food was absolutely horrible!,food,negative
"the people with carts of food don't understand you because they don't speak english, their job is to give you the delicious food you point at.",food,positive
drinks way over priced.,price,negative
what i didn't like was how the food came right after it was ordered.,food,negative
"most importantly, food is excellent.",food,positive
the food was mediocre at best but it was the horrible service that made me vow never to go back.,service,negative
"the service was terrible, we had to wait for everything and ask several of different people for the same thing before we were allowed to be served.",service,negative
"other than being a little crowded and a bit overpriced, the atmosphere is filled with energy (and the beautiful people of course) and the food was surprising good!",price,negative
"other than being a little crowded and a bit overpriced, the atmosphere is filled with energy (and the beautiful people of course) and the food was surprising good!",food,positive
rao's has the best service and atmosphere in nyc.,service,positive
service was also horrible and the ambience is not that great.,ambience,negative
service was also horrible and the ambience is not that great.,service,negative
"service is great, takeout is good too.",service,positive
the pizza is overpriced and soggy.,price,positive
"for the quality of food, a little too expensive.",food,negative
i've never had bad service and the fish is fresh and delicious.,service,positive
"everything is always cooked to perfection, the service is excellent, the decor cool and understated.",service,positive
the thai food is good.,food,positive
"great selection of wine, and seafood.",food,positive
acceptable prices.,price,positive
definitely not worth the price!,price,negative
"orsay, is a very pleasnt throw back to traditional french food, and french service as well.",food,positive
"orsay, is a very pleasnt throw back to traditional french food, and french service as well.",service,positive
great food at reasonable prices.,price,positive
great food at reasonable prices.,food,positive
the prices are about $9 for an entree for dinner and even less for lunch.,price,positive
and you can't beat the prices.,price,positive
prices too high for this cramped and unappealing resturant.,price,negative
"everything, from the soft bread, soggy salad, and 50 minute wait time, with an incredibly rude service to deliver below average food.",food,negative
"everything, from the soft bread, soggy salad, and 50 minute wait time, with an incredibly rude service to deliver below average food.",service,negative
the menu prices are a bit expensive for what you get in quality and portion size.,price,negative
"the food was amazing, and the service was prompt and helpful, but not over-bearing or rushed.",food,positive
"the food was amazing, and the service was prompt and helpful, but not over-bearing or rushed.",service,positive
"the food was not fresh, the sauces were bland and very oily.",food,negative
could be pricey without a prix fixe meal.,price,negative
the service was fast and friendly and the food was very tasty and they had the best hot sauce to add to your meals.,food,positive
the service was fast and friendly and the food was very tasty and they had the best hot sauce to add to your meals.,service,positive
scalina fedeli reminded me why service is so integral to fine dining.,service,positive
"everything looks great, the drinks, the decor, the food, even the people.",food,positive
my fiance took me to scopa last week for my birthday and i couldn't believe the food.,food,positive
"the halibut was too salty, dessert was so so (don't waste any of your calories) and service was poor.",service,negative
"the view is spectacular, and the food is great.",food,positive
"the food is wonderful, tasty and filling, and the service is professional and friendly.",food,positive
"the food is wonderful, tasty and filling, and the service is professional and friendly.",service,positive
it is also extremely well priced.,price,positive
always great service!,service,positive
i am happy i did the food was awsome.,food,positive
my wife and i ate here earlier this week and have not stopped ranting and raving about the food.,food,positive
the food itself was just ok - nothing spectacular - but the service was awful.,service,negative
good food.,food,positive
"however, go for the ambience, and consider the food just a companion for a trip across the world!",food,negative
"however, go for the ambience, and consider the food just a companion for a trip across the world!",ambience,positive
incredible food at a very agreable price brings me back just about every other day to this authentic thai restaurant.,price,positive
incredible food at a very agreable price brings me back just about every other day to this authentic thai restaurant.,food,positive
a little pricey but it really hits the spot on a sunday morning!,price,negative
"the staff isn't the friendliest or most competent, and i am stickler for service, but everything else about this place makes up for it.",service,negative
i have been coming here for years and have nothing but good things to say about the service and the great staff at la lanterna.,service,positive
"it cannot be the ambience, because the place is very cramped and some guests have to sit in an aisle.",ambience,negative
authentic pakistani food.,food,positive
"quality ingredients preparation all around, and a very fair price for nyc.",price,positive
"service was very good - prompt, attentive and non-intrusive.",service,positive
"my entree of hot pot with seafood was full of imitation crabmeat with a couple pieces of shrimp and squid, and was unnecessarily heated with a burner.",food,negative
"in fact, while leaving the place we saw two people looking at the menu, and i couldn't help telling them that the food was horrible.",food,negative
"if you want americanized chinese food with your usual watery, generic white sauce, this is your place.",food,negative
"service is friendly, prices are good - delivery time was a little slow, but for the way this pizza tastes, i'm willing to overlook it.",price,positive
the food can get pricey but the prixe fixe tasting menu is the greatest food for a good price and they cater the food to any food allergies or food you don't like.,food,positive
"the service is excellent, the decor is great, and the food is delicious and comes in large portions.",food,positive
"the service is excellent, the decor is great, and the food is delicious and comes in large portions.",service,positive
an excellent service,service,positive
"food is average, and i would say even the chain restaurant baluchi's tastes better.",food,negative
the place is small and cramped but the food is fantastic.,food,positive
the food is tasty and portion sizes are appropriate.,food,positive
the food there is so good that even to order out the wait is incredible.,food,positive
"for authentic thai food, look no further than toons.",food,positive
"the highlight of the night was the mayonaisse for my side of fries i received from one of the food runners, which is not good considering the bill was nearly $100.",food,negative
the ambience is very romantic and definitely a good place to bring a date.,ambience,positive
"the food is very good for it's price, better than most fried dumplings i've had.",price,positive
"the food is very good for it's price, better than most fried dumplings i've had.",food,positive
there are much better places in ny with better prices.,price,negative
the ambience is very calm and quiet.,ambience,positive
"both times i was extremely dissappointed by the service, which was boarderline rude.",service,negative
the spicy tuna roll is huge and probably the best that i've had at this price range.,price,positive
price and quality of fish alone will keep us from making a return visit.,price,negative
this is one of the best comfort food places in the city.,food,positive
"considering their price of $6.25 for lunch special, the dish was ridiculously small.",price,negative
this is the pinnacle of indian fast food (all fast foods in my opinion).,food,positive
"besides, when you have bad service, that's less money you have to tip.",service,negative
"service was devine, oysters where a sensual as they come, and the price can't be beat!!!",price,positive
"service was devine, oysters where a sensual as they come, and the price can't be beat!!!",service,positive
ballato's is consistently delicious authentic italian food.,food,positive
"the service was attentive, yet discreet.",service,positive
for those prices and the dressed up atmosphere you expect more and should get more.,price,negative
we went to eat at the jekyll and hyde restaurant on friday night and really enjoyed the fun atmosphere and good food.,food,positive
the food was pretty tradional but it was hot and good with large portions.,food,positive
you have to increase the service a lot.,service,negative
"service is extraordinary, yet not overbearing, and the decor brings a taste of trendy soho into queens.",service,positive
the service was excellent and the food was delicious.,food,positive
the service was excellent and the food was delicious.,service,positive
"thalia is a beautiful restaurant with beautiful people serving you, but the food doesn't quite match up.",food,negative
a restaurant that doesn't try to do anything except serve great food with great service in a pleasant atmosphere.,food,positive
a restaurant that doesn't try to do anything except serve great food with great service in a pleasant atmosphere.,service,positive
"found service above average, but that could be because we were 13 of us.",service,positive
overall a disappointing experience for that price category.,price,negative
the food was exceptional.,food,positive
